{
  "schemaVersion": 1,
  "engagementId": "CGQA-E-001",
  "adapterId": "engagement-fixture-v1.3",
  "scopeId": "local-v1.3-engagement-fixture",
  "manifestSha256": "b9c805a0c37fb2dbe75af45e4649cfd2a9bd5d57e2be0f4402628d0bc7a052eb",
  "searchRunId": "local-engagement-search-001",
  "replay": "forge test --match-test test_CaptureMultiInvariantEngagementResult -vvv",
  "checks": [
    {
      "invariantId": "terminal-state-bound",
      "status": "violated",
      "findingId": "CGQA-E-001-F01",
      "exploredCandidates": 6,
      "notes": "The repository-local fixture reaches the modeled terminal state through the shortest three-step advance path.",
      "path": [
        {
          "actionId": "advance",
          "preState": "phase=0",
          "postState": "phase=1",
          "effect": "first future-relevant protocol state is reached"
        },
        {
          "actionId": "advance",
          "preState": "phase=1",
          "postState": "phase=2",
          "effect": "second future-relevant protocol state is reached"
        },
        {
          "actionId": "advance",
          "preState": "phase=2",
          "postState": "phase=3",
          "effect": "terminal-state invariant becomes false"
        }
      ]
    },
    {
      "invariantId": "phase-nonnegative",
      "status": "not_found_within_bound",
      "exploredCandidates": 8,
      "notes": "No negative phase was found within the declared local action corpus and maxDepth=4 bounded model."
    },
    {
      "invariantId": "budget-sensitive-branch",
      "status": "inconclusive",
      "exploredCandidates": 8,
      "notes": "The local evaluator intentionally returns inconclusive so unresolved evidence is not presented as a clean check."
    }
  ]
}
